{
  "$schema": "https://json-schema.org/draft/2020-12/schema",
  "title": "OSM map feature collection",
  "description": "A list of OSM map feature templates, each with an additional visual and textual representation.",
  "type": "array",
  "items": {
    "type": "object",
    "description": "A map feature template.",
    "required": [ "name", "icon", "osm_tags", "osm_element" ],
    "additionalProperties": false,
    "properties": {
      "name": {
        "description": "A label describing this map feature.",
        "type": "string"
      },
      "icon": {
        "description": "The icon name/identifier from the custom icons map.",
        "type": "string"
      },
      "osm_tags": {
        "description": "A map of OSM tags that define this map feature.",
        "type": "object",
        "additionalProperties": {
          "type": "string"
        }
      },
      "osm_element": {
        "description": "The type of OSM element that builds the foundation of this map feature.",
        "$ref": "#/definitions/osm_element_type"
      }
    }
  },
  "definitions": {
    "osm_element_type": { "enum": ["Node", "OpenWay", "ClosedWay", "Relation"] }
  }
}
